{
  "simulationId": "transactions-isolation",
  "schemaVersion": "1.0",
  "modelVersion": "1.0.0",
  "kind": "analysis",
  "status": "completed",
  "input": {
    "schemaVersion": "1.0",
    "modelVersion": "1.0.0",
    "strategy": "ATOMIC_CONDITIONAL_RESERVATION",
    "initialUnits": 1,
    "reservations": [
      { "id": "a", "quantity": 1 },
      { "id": "b", "quantity": 1 }
    ],
    "schedule": [
      { "id": "read-a", "reservationId": "a", "action": "READ" },
      { "id": "read-b", "reservationId": "b", "action": "READ" },
      { "id": "attempt-a", "reservationId": "a", "action": "ATTEMPT_RESERVE" },
      { "id": "attempt-b", "reservationId": "b", "action": "ATTEMPT_RESERVE" }
    ]
  },
  "initialState": {
    "remainingUnits": 1,
    "allocatedUnits": 0,
    "reservations": [
      { "id": "a", "quantity": 1, "status": "NOT_READ" },
      { "id": "b", "quantity": 1, "status": "NOT_READ" }
    ],
    "allocations": [],
    "invariants": {
      "remainingNonnegative": true,
      "allocatedWithinCapacity": true,
      "unitsConserved": true,
      "accountedUnits": 1
    }
  },
  "outcomes": [
    {
      "sequence": 1,
      "stepId": "read-a",
      "reservationId": "a",
      "action": "READ",
      "kind": "READ_OBSERVED",
      "postState": {
        "remainingUnits": 1,
        "allocatedUnits": 0,
        "reservations": [
          {
            "id": "a",
            "quantity": 1,
            "status": "READ_OBSERVED",
            "observedRemaining": 1
          },
          { "id": "b", "quantity": 1, "status": "NOT_READ" }
        ],
        "allocations": [],
        "invariants": {
          "remainingNonnegative": true,
          "allocatedWithinCapacity": true,
          "unitsConserved": true,
          "accountedUnits": 1
        }
      },
      "explanation": "a observes 1 remaining units. This is a preview; its later attempt will check current shared stock. The read changes only its observation and status, not stock or allocations.",
      "observedRemaining": 1
    },
    {
      "sequence": 2,
      "stepId": "read-b",
      "reservationId": "b",
      "action": "READ",
      "kind": "READ_OBSERVED",
      "postState": {
        "remainingUnits": 1,
        "allocatedUnits": 0,
        "reservations": [
          {
            "id": "a",
            "quantity": 1,
            "status": "READ_OBSERVED",
            "observedRemaining": 1
          },
          {
            "id": "b",
            "quantity": 1,
            "status": "READ_OBSERVED",
            "observedRemaining": 1
          }
        ],
        "allocations": [],
        "invariants": {
          "remainingNonnegative": true,
          "allocatedWithinCapacity": true,
          "unitsConserved": true,
          "accountedUnits": 1
        }
      },
      "explanation": "b observes 1 remaining units. This is a preview; its later attempt will check current shared stock. The read changes only its observation and status, not stock or allocations.",
      "observedRemaining": 1
    },
    {
      "sequence": 3,
      "stepId": "attempt-a",
      "reservationId": "a",
      "action": "ATTEMPT_RESERVE",
      "kind": "RESERVATION_ACCEPTED",
      "postState": {
        "remainingUnits": 0,
        "allocatedUnits": 1,
        "reservations": [
          {
            "id": "a",
            "quantity": 1,
            "status": "ACCEPTED",
            "observedRemaining": 1
          },
          {
            "id": "b",
            "quantity": 1,
            "status": "READ_OBSERVED",
            "observedRemaining": 1
          }
        ],
        "allocations": [
          { "reservationId": "a", "quantity": 1, "stepId": "attempt-a" }
        ],
        "invariants": {
          "remainingNonnegative": true,
          "allocatedWithinCapacity": true,
          "unitsConserved": true,
          "accountedUnits": 1
        }
      },
      "explanation": "a checks current shared stock 1 against quantity 1. Accepted: the current check, decrement 1 - 1 = 0 and allocation append form one indivisible modeled action. Allocated units now total 1. This local acceptance promises no database durability.",
      "checkedRemaining": 1,
      "checkSource": "CURRENT",
      "quantity": 1
    },
    {
      "sequence": 4,
      "stepId": "attempt-b",
      "reservationId": "b",
      "action": "ATTEMPT_RESERVE",
      "kind": "RESERVATION_REJECTED",
      "postState": {
        "remainingUnits": 0,
        "allocatedUnits": 1,
        "reservations": [
          {
            "id": "a",
            "quantity": 1,
            "status": "ACCEPTED",
            "observedRemaining": 1
          },
          {
            "id": "b",
            "quantity": 1,
            "status": "REJECTED",
            "observedRemaining": 1
          }
        ],
        "allocations": [
          { "reservationId": "a", "quantity": 1, "stepId": "attempt-a" }
        ],
        "invariants": {
          "remainingNonnegative": true,
          "allocatedWithinCapacity": true,
          "unitsConserved": true,
          "accountedUnits": 1
        }
      },
      "explanation": "b checks current shared stock 0 against quantity 1. The checked value is insufficient. Its status becomes REJECTED; remaining stock stays 0 and allocations are unchanged.",
      "checkedRemaining": 0,
      "checkSource": "CURRENT",
      "quantity": 1,
      "rejectionReason": "INSUFFICIENT_STOCK"
    }
  ],
  "finalState": {
    "remainingUnits": 0,
    "allocatedUnits": 1,
    "reservations": [
      {
        "id": "a",
        "quantity": 1,
        "status": "ACCEPTED",
        "observedRemaining": 1
      },
      { "id": "b", "quantity": 1, "status": "REJECTED", "observedRemaining": 1 }
    ],
    "allocations": [
      { "reservationId": "a", "quantity": 1, "stepId": "attempt-a" }
    ],
    "invariants": {
      "remainingNonnegative": true,
      "allocatedWithinCapacity": true,
      "unitsConserved": true,
      "accountedUnits": 1
    }
  },
  "metrics": {
    "acceptedReservations": 1,
    "rejectedReservations": 1,
    "finalRemainingUnits": 0,
    "finalAllocatedUnits": 1,
    "invariantStatus": "PRESERVED"
  },
  "assumptions": [
    "This is an illustrative reservation interleaving, not a database engine or an isolation-level emulator.",
    "Schedule order is explicit. No elapsed time, random choice or actual thread scheduling is modeled.",
    "Each distinct reservation reads once and attempts once; this model does not deduplicate retried business requests.",
    "The stale strategy checks its saved observation and assigns remaining stock from that observation.",
    "The conditional strategy checks current stock and changes stock plus its allocation in one indivisible modeled action.",
    "Accepted allocations are local model state, not a durable database commit, payment or external effect.",
    "A rejection changes the reservation status but leaves stock and allocations unchanged.",
    "Capacity, nonnegative remaining stock and conservation are separate Java-reported checks at every observed prefix.",
    "Completed means the schedule was evaluated; it can include rejected reservations or an intentional invariant violation.",
    "Lock waiting, versions, rollback, crashes, retries, replicas and multiple-resource transactions are excluded."
  ]
}
